[
  {
    "operatorId": "OP-a1b2c3d4-e5f6-7890-abcd-ef1234567890",
    "walletAddress": "0x1234567890abcdef1234567890abcdef12345678",
    "displayName": "Alpha Observer",
    "email": "alpha@example.com",
    "role": "OBSERVER",
    "status": "ACTIVE",
    "suspended": false,
    "verificationTier": "LIGHT",
    "verificationArtifacts": {
      "emailProofHash": "sha256:a1b2c3d4e5f6789012345678901234567890abcdef1234567890abcdef123456",
      "walletSignatureHash": "sha256:b2c3d4e5f6789012345678901234567890abcdef1234567890abcdef1234567a"
    },
    "charterAcknowledgmentHash": "sha256:c3d4e5f6789012345678901234567890abcdef1234567890abcdef1234567890",
    "certificationHash": "sha256:d4e5f6789012345678901234567890abcdef1234567890abcdef12345678901234",
    "settlementsCompleted": 0,
    "attestationsProvided": 0,
    "incidentCount": 0,
    "createdAt": "2026-01-15T10:00:00Z",
    "updatedAt": "2026-01-28T14:30:00Z",
    "activatedAt": "2026-01-28T14:30:00Z",
    "lastActivityAt": "2026-01-31T09:00:00Z"
  },
  {
    "operatorId": "OP-b2c3d4e5-f6a7-8901-bcde-f23456789012",
    "walletAddress": "0xabcdef1234567890abcdef1234567890abcdef12",
    "displayName": "Beta Validator",
    "email": "beta@example.com",
    "role": "VALIDATOR",
    "status": "ACTIVE",
    "suspended": false,
    "verificationTier": "STANDARD",
    "verificationArtifacts": {
      "emailProofHash": "sha256:e5f6789012345678901234567890abcdef1234567890abcdef1234567890abcd",
      "walletSignatureHash": "sha256:f6789012345678901234567890abcdef1234567890abcdef1234567890abcdef",
      "kycDocumentHash": "sha256:789012345678901234567890abcdef1234567890abcdef1234567890abcdef12",
      "referenceCheckHash": "sha256:89012345678901234567890abcdef1234567890abcdef1234567890abcdef1234"
    },
    "charterAcknowledgmentHash": "sha256:9012345678901234567890abcdef1234567890abcdef1234567890abcdef123456",
    "certificationHash": "sha256:012345678901234567890abcdef1234567890abcdef1234567890abcdef12345678",
    "settlementsCompleted": 2,
    "attestationsProvided": 4,
    "incidentCount": 0,
    "createdAt": "2026-01-10T08:00:00Z",
    "updatedAt": "2026-01-30T16:00:00Z",
    "activatedAt": "2026-01-20T11:00:00Z",
    "lastActivityAt": "2026-01-31T15:30:00Z"
  }
]
